{
  "schema_version": "1.0.0",
  "evidence_id": "evd_01JBQ8Z4K7M3N9P2R5T6V8W0ZF",
  "context_id": "arbeitgeber_visolva",
  "action_id": "act_01JBQ8Z4K7M3N9P2R5T6V8W0ZE",
  "evidence_type": "provider_id",
  "system_adapter_id": "messaging_superchat",
  "observed_at": "2026-08-29T07:31:44Z",
  "observed_values": {
    "provider_message_id": "EXTERNAL_PROVIDER_MESSAGE_ID_PLACEHOLDER",
    "provider_status": "delivered"
  },
  "verification": {
    "method": "provider_message_id",
    "result": "confirmed",
    "verified_at": "2026-08-29T07:31:44Z",
    "verified_by": "verifier",
    "detail": "Der Anbieter hat eine unveraenderliche Nachrichten-ID und den Status delivered zurueckgemeldet.",
    "contract_ref": {
      "tool_id": "messaging_superchat.send_template_message",
      "tool_version": "1.0.0",
      "readback_supported": false
    },
    "limitation": "Belegt die Annahme und Auslieferung durch den Anbieter, nicht das Lesen oder Verstehen durch den Empfaenger.",
    "deferred_check_due_at": "2026-08-30T07:31:44Z"
  },
  "created_at": "2026-08-29T07:31:44Z",
  "producer": {
    "producer_type": "agent",
    "producer_id": "verifier",
    "producer_version": "1.0.0"
  },
  "trace": {
    "trace_id": "tr-20260829-0002",
    "correlation_id": "co-20260829-0002",
    "workflow_name": "JV-P0-CORE-event_ingest-v1",
    "workflow_version": "1.0.0"
  }
}
